[
  {
    "id": "carcaca:criatura:joro-sonhos-afogados",
    "schema_version": "0.1.0",
    "nome": "Jorō Aracne dos Sonhos Afogados",
    "categoria": "personagem_unico",
    "estado": "piloto",
    "tipo_carcaca": "yokai",
    "tipo_carcaca_status": "confirmado",
    "tipo_dnd_referencia": {
      "original": "Grande feérica (yokai)",
      "tipo": "feérico",
      "equivalente_padrao": "fey",
      "fonte": "arquivo_mortos_afogados"
    },
    "ancestralidade": [],
    "tradicoes": [
      "yokai",
      "sonho-raiz-luz"
    ],
    "faccoes": [
      {
        "id": "faccao:guardioes-yokai-da-foz",
        "vinculo": "guardia",
        "evidencia": "documentado"
      }
    ],
    "ocorrencias": [
      {
        "regiao_id": "regiao:foz-rio-ancestral",
        "lugar_id": "lugar:arquivo-dos-mortos-afogados",
        "situacao": "guardia residente",
        "status": "documentado"
      }
    ],
    "ecologia": {
      "habitat": "Câmaras inundadas do Arquivo; água, reflexos, teias e paredes úmidas",
      "habitos": [
        "Observa, julga e testa intrusos antes de optar pelo confronto",
        "Interpreta lealdade e autonomia como critérios para proteger a Lança"
      ],
      "alimentacao": null,
      "ciclo_atividade": null,
      "organizacao": {
        "estrutura": "guardiã ritual individual",
        "tag_dw": "solitario",
        "status_tag_dw": "proposto"
      }
    },
    "relacoes": [
      {
        "alvo_id": "faccao:corte-shadow-fey",
        "tipo": "hostilidade_a_subserviencia",
        "descricao": "Hostil a quem se mantém servil à Corte; não a todo feérico indistintamente",
        "status": "documentado"
      },
      {
        "alvo_id": "faccao:demonios-do-abismo",
        "tipo": "hostilidade_a_subserviencia",
        "descricao": "Rejeita a servidão aos demônios",
        "status": "documentado"
      }
    ],
    "dungeon_world": {
      "estado": "adaptacao_narrativa_em_revisao",
      "instinto": "Encontrar e provar um portador digno da Lança, capaz de restaurar a possibilidade de Sonho.",
      "movimentos": [
        {
          "nome": "Tecelã do sonho submerso",
          "texto": "Fazer um intruso reconhecer um rosto impossível em outro ser.",
          "origem": "adaptado_da_ficcao"
        },
        {
          "nome": "Corpo entre véus",
          "texto": "Atravessar reflexos, água e teias para mudar a posição da ameaça.",
          "origem": "adaptado_da_ficcao"
        },
        {
          "nome": "Julgamento do sonho",
          "texto": "Impor uma prova de autonomia a quem busca a Lança.",
          "origem": "adaptado_da_ficcao"
        }
      ],
      "qualidades": [
        "Guardiã yokai",
        "Teias oníricas",
        "Rituais de identidade e memória"
      ],
      "tags_propostas": [
        "solitario",
        "magico",
        "inteligente"
      ],
      "estatisticas": {
        "estado": "nao_calculadas",
        "pv": null,
        "armadura": null,
        "dano": null,
        "observacao": "Preencher apenas com procedimento de criação de monstros DW, não por fórmula do ND."
      }
    },
    "dnd5e": {
      "origem": "ficha_autoral",
      "nd": 14,
      "ca": 18,
      "pv": 225,
      "observacao": "Valores documentados na ficha autoral, não importados dos SRDs."
    },
    "proveniencia": {
      "fontes": [
        "arquivo_mortos_afogados"
      ],
      "status_fatos": "documentado",
      "status_movimentos_dw": "adaptacao_proposta"
    },
    "notas_editoriais": "Protege o legado da foz por critério próprio; não converter automaticamente em inimiga da população."
  },
  {
    "id": "carcaca:criatura:gharoz-sonho-podre",
    "schema_version": "0.1.0",
    "nome": "Gharoz, o Crocodilo Gordo do Sonho Podre",
    "categoria": "personagem_unico",
    "estado": "piloto",
    "tipo_carcaca": "demonio",
    "tipo_carcaca_status": "confirmado",
    "tipo_dnd_referencia": {
      "original": "Enorme corruptor (demônio)",
      "tipo": "corruptor",
      "equivalente_padrao": null,
      "fonte": "arquivo_mortos_afogados"
    },
    "ancestralidade": [],
    "tradicoes": [],
    "faccoes": [
      {
        "id": "faccao:demonios-do-abismo",
        "vinculo": "operador_demoníaco",
        "evidencia": "documentado"
      }
    ],
    "ocorrencias": [
      {
        "regiao_id": "regiao:foz-rio-ancestral",
        "lugar_id": "lugar:arquivo-dos-mortos-afogados",
        "situacao": "disputa pela Lança da Perdição e pelo destino da foz",
        "status": "documentado"
      }
    ],
    "ecologia": {
      "habitat": "Águas e margens da foz, com infiltração demoníaca e efeitos psíquicos",
      "habitos": [
        "Observa e espera antes de agir",
        "Busca desorientar, devorar esperança e desagregar alianças"
      ],
      "alimentacao": "Resíduos de sonho e aflição, segundo a história",
      "ciclo_atividade": null,
      "organizacao": {
        "estrutura": "agente de ameaça com associados demoníacos",
        "tag_dw": "solitario",
        "status_tag_dw": "proposto"
      }
    },
    "relacoes": [
      {
        "alvo_id": "faccao:guardioes-yokai-da-foz",
        "tipo": "conflito",
        "descricao": "Quer destruir a possibilidade de restauração que os guardiões preservam",
        "status": "documentado"
      },
      {
        "alvo_id": "lugar:gualapolis",
        "tipo": "ameaca",
        "descricao": "Pretende arrastar a cidade e seu legado ao Abismo",
        "status": "documentado"
      }
    ],
    "dungeon_world": {
      "estado": "adaptacao_narrativa_em_revisao",
      "instinto": "Consumir a esperança da foz e destruir a possibilidade de restaurá-la.",
      "movimentos": [
        {
          "nome": "Devorador de sonhos",
          "texto": "Transformar medo e desorientação dos presentes em força própria.",
          "origem": "adaptado_da_ficcao"
        },
        {
          "nome": "Aura de afogamento",
          "texto": "Fazer uma ameaça sentir os pulmões encherem de água onde não deveria.",
          "origem": "adaptado_da_ficcao"
        },
        {
          "nome": "Abrir a boca do Abismo",
          "texto": "Romper uma passagem entre águas para permitir o avanço de forças demoníacas.",
          "origem": "adaptado_da_ficcao"
        }
      ],
      "qualidades": [
        "Crocodilo demoníaco colossal",
        "Fome de sonhos",
        "Poder sobre águas corrompidas"
      ],
      "tags_propostas": [
        "solitario",
        "magico",
        "enorme"
      ],
      "estatisticas": {
        "estado": "nao_calculadas",
        "pv": null,
        "armadura": null,
        "dano": null,
        "observacao": "Preencher com perguntas de criação DW; ND 14 não equivale a nível DW."
      }
    },
    "dnd5e": {
      "origem": "ficha_autoral",
      "nd": 14,
      "ca": 18,
      "pv": 240,
      "observacao": "O tipo original 'corruptor' é conservado; não normalizar sem revisão."
    },
    "proveniencia": {
      "fontes": [
        "arquivo_mortos_afogados"
      ],
      "status_fatos": "documentado",
      "status_movimentos_dw": "adaptacao_proposta"
    },
    "notas_editoriais": "A hipótese sobre como surgiu é mantida em aberto no texto original."
  },
  {
    "id": "carcaca:criatura:akaname-espelho-fundo",
    "schema_version": "0.1.0",
    "nome": "Akaname do Espelho Fundo",
    "categoria": "personagem_unico",
    "estado": "rascunho",
    "tipo_carcaca": "yokai",
    "tipo_carcaca_status": "confirmado",
    "tipo_dnd_referencia": {
      "original": "Médio feérico (yokai)",
      "tipo": "feérico",
      "equivalente_padrao": "fey",
      "fonte": "arquivo_mortos_afogados"
    },
    "ancestralidade": [],
    "tradicoes": [
      "yokai",
      "memoria-ritual-da-foz"
    ],
    "faccoes": [
      {
        "id": "faccao:guardioes-yokai-da-foz",
        "vinculo": "servidor_ritual",
        "evidencia": "inferido"
      }
    ],
    "ocorrencias": [
      {
        "regiao_id": "regiao:foz-rio-ancestral",
        "lugar_id": "lugar:arquivo-dos-mortos-afogados",
        "situacao": "Presença ritual no Arquivo",
        "status": "documentado"
      }
    ],
    "ecologia": {
      "habitat": "Câmaras úmidas e inundadas do Arquivo dos Mortos Afogados",
      "habitos": [
        "Induz leituras falsas, erros de percepção e insegurança em intrusos confiantes",
        "Pune a profanação de inscrições e nomes rituais",
        "Distingue intrusos respeitosos de saqueadores"
      ],
      "alimentacao": null,
      "ciclo_atividade": null,
      "organizacao": {
        "estrutura": "Guardião singular do Espelho Fundo; remanescente de servos e escribas rituais.",
        "tag_dw": "solitario",
        "status_tag_dw": "proposto"
      }
    },
    "relacoes": [
      {
        "alvo_id": "lugar:arquivo-dos-mortos-afogados",
        "tipo": "protecao_ritual",
        "descricao": "Preserva a função ritual das câmaras e tenta impedir acesso indigno à Lança.",
        "status": "documentado"
      }
    ],
    "dungeon_world": {
      "estado": "adaptacao_narrativa_em_revisao",
      "instinto": "Impedir que mãos indignas profanem os registros do Arquivo e alcancem a Lança.",
      "movimentos": [
        {
          "nome": "Língua do Espelho",
          "texto": "Misturar rosto, reflexo e duplicata até alguém desconfiar dos próprios olhos.",
          "origem": "adaptado_da_ficcao"
        },
        {
          "nome": "Passo pelas Superfícies",
          "texto": "Cruzar paredes molhadas, espelhos e poças como passagens.",
          "origem": "adaptado_da_ficcao"
        },
        {
          "nome": "Prisão de Água Lisa",
          "texto": "Prender um intruso numa película de água que aparenta profundidade impossível.",
          "origem": "adaptado_da_ficcao"
        }
      ],
      "qualidades": [
        "Olhos espelhados",
        "Etiqueta ritual deformada",
        "Manipulação de reflexos"
      ],
      "tags_propostas": [
        "solitario",
        "magico",